{
  "$schema": "https://json-schema.org/draft/2020-12/schema",
  "$id": "https://prototype-factory.local/schemas/init-contract.schema.json",
  "title": "Initialization Boundary Contract",
  "description": "Which parts of this repository are Factory Core, which are the Reference Sample, and which are the initialization surface a new product must rewrite. `stage` is declared and then cross-checked: a tree that renames its package may not keep calling itself the baseline.",
  "type": "object",
  "additionalProperties": false,
  "required": ["schemaVersion", "stage", "baselineIdentity", "sampleOwned", "productFacing", "sampleMarkers"],
  "properties": {
    "$schema": { "type": "string" },
    "schemaVersion": { "const": 1, "description": "Version of this contract." },
    "stage": {
      "enum": ["baseline", "product"],
      "description": "`baseline` = the Factory itself (Reference Sample allowed, baseline identity must be intact). `product` = an initialized tree (no baseline or sample identity on the initialization surface)."
    },
    "baselineIdentity": {
      "type": "object",
      "additionalProperties": false,
      "required": ["packageName", "metadataTitle", "landingMarker"],
      "description": "What the uninitialized baseline looks like. Product stage requires all of these to be gone.",
      "properties": {
        "packageName": { "type": "string", "minLength": 1 },
        "metadataTitle": { "type": "string", "minLength": 1 },
        "landingMarker": { "type": "string", "minLength": 1 }
      }
    },
    "sampleOwned": {
      "type": "array",
      "minItems": 1,
      "description": "Path prefixes owned by the Reference Sample. Identity is legal inside these; they are excluded from the scan and counted in the report.",
      "items": { "type": "string", "minLength": 1 }
    },
    "productFacing": {
      "type": "array",
      "minItems": 1,
      "description": "The initialization surface: files a new product must check, rewrite or delete. Every one of them must exist.",
      "items": { "type": "string", "minLength": 1 }
    },
    "sampleMarkers": {
      "type": "array",
      "minItems": 1,
      "description": "Strings that identify the Reference Sample's own product identity. Forbidden on the initialization surface in product stage.",
      "items": { "type": "string", "minLength": 1 }
    }
  }
}
